{"schema_version":"1.0.0","project_id":"novel_example","episode_number":1,"scene_id":"ep001-sc001","source_state_version":"0.1.0","participants":[{"character_id":"protagonist","known_facts":["the inspector sees the mismatch"],"desire":"move suspicion away from the missing page","concealed_information":["kept the original page"],"expected_action":"offer a plausible secondary discrepancy","speech_purpose":"control the search order","emotion_before":"controlled anxiety","emotion_after":"temporary relief"},{"character_id":"inspector","known_facts":["the totals do not match"],"desire":"identify who altered the ledger","concealed_information":[],"expected_action":"test the protagonist with a false date","speech_purpose":"provoke a revealing correction","emotion_before":"suspicious","emotion_after":"more suspicious"},{"character_id":"clerk","known_facts":["the protagonist took a page"],"desire":"avoid being questioned","concealed_information":["witnessed the page removal"],"expected_action":"interrupt with an irrelevant filing error","speech_purpose":"end the inspection early","emotion_before":"fearful","emotion_after":"panicked"}],"writer_use":"structured_input_only_not_prose"}
